{"analysis_scope_digest":"f56b78795614457eda36e55aec034b558aca4825ebe01e158ea55d547114583e","artifact_kind":"REVIEW_POLICY","canonicalization_profile":"veritrail-json-c14n/1","derivation_profile_digest":"e8bbe54140ff2a082b69d6b6967d8630a423abd135ac6e7be0badc1fe053125b","execution_budget":{"artifact_bytes":67108864,"memory_bytes":268435456,"wall_clock_ms":30000},"governance":{"claim_owner_ref":"reference-lab-human","drafter_ref":"reference-lab-drafter","seal_authority_ref":"reference-lab-human","seal_decision":"CONFIRMED"},"policy_digest":"83e21d837b65b01eeedffe1702f4a576a71f27037708c0f6ae825d704bb2b7b9","policy_id":"reference-lab-policy","provider_requirements":[{"capability_id":"python-ast","composition_mode":"CUMULATIVE","required":true}],"python_module_mapping":{"module_root":{"git_path_hex":"706c7567696e732f6769746875622d65766964656e63652f7372632f76657269747261696c5f676974687562","path_kind":"GIT_PATH"},"package_prefix":["veritrail_github"]},"schema_version":"0.1","scope_decisions":[{"disposition":"IN_SCOPE","git_path":{"git_path_hex":"706c7567696e732f6769746875622d65766964656e63652f7372632f76657269747261696c5f6769746875622f5f5f696e69745f5f2e7079","path_kind":"GIT_PATH"},"reason_code":"POLICY_INCLUDED","source_class":"FIRST_PARTY"},{"disposition":"IN_SCOPE","git_path":{"git_path_hex":"706c7567696e732f6769746875622d65766964656e63652f7372632f76657269747261696c5f6769746875622f5f5f6d61696e5f5f2e7079","path_kind":"GIT_PATH"},"reason_code":"POLICY_INCLUDED","source_class":"FIRST_PARTY"},{"disposition":"IN_SCOPE","git_path":{"git_path_hex":"706c7567696e732f6769746875622d65766964656e63652f7372632f76657269747261696c5f6769746875622f636c692e7079","path_kind":"GIT_PATH"},"reason_code":"POLICY_INCLUDED","source_class":"FIRST_PARTY"},{"disposition":"IN_SCOPE","git_path":{"git_path_hex":"706c7567696e732f6769746875622d65766964656e63652f7372632f76657269747261696c5f6769746875622f636f6c6c6563746f722e7079","path_kind":"GIT_PATH"},"reason_code":"POLICY_INCLUDED","source_class":"FIRST_PARTY"},{"disposition":"IN_SCOPE","git_path":{"git_path_hex":"706c7567696e732f6769746875622d65766964656e63652f7372632f76657269747261696c5f6769746875622f636f6e666f726d616e63652e7079","path_kind":"GIT_PATH"},"reason_code":"POLICY_INCLUDED","source_class":"FIRST_PARTY"},{"disposition":"IN_SCOPE","git_path":{"git_path_hex":"706c7567696e732f6769746875622d65766964656e63652f7372632f76657269747261696c5f6769746875622f636f6e7472616374732e7079","path_kind":"GIT_PATH"},"reason_code":"POLICY_INCLUDED","source_class":"FIRST_PARTY"},{"disposition":"IN_SCOPE","git_path":{"git_path_hex":"706c7567696e732f6769746875622d65766964656e63652f7372632f76657269747261696c5f6769746875622f6572726f72732e7079","path_kind":"GIT_PATH"},"reason_code":"POLICY_INCLUDED","source_class":"FIRST_PARTY"},{"disposition":"IN_SCOPE","git_path":{"git_path_hex":"706c7567696e732f6769746875622d65766964656e63652f7372632f76657269747261696c5f6769746875622f68616e646f66662e7079","path_kind":"GIT_PATH"},"reason_code":"POLICY_INCLUDED","source_class":"FIRST_PARTY"},{"disposition":"IN_SCOPE","git_path":{"git_path_hex":"706c7567696e732f6769746875622d65766964656e63652f7372632f76657269747261696c5f6769746875622f68616e646f66665f636f6e7472616374732e7079","path_kind":"GIT_PATH"},"reason_code":"POLICY_INCLUDED","source_class":"FIRST_PARTY"},{"disposition":"IN_SCOPE","git_path":{"git_path_hex":"706c7567696e732f6769746875622d65766964656e63652f7372632f76657269747261696c5f6769746875622f6e6f726d616c697a652e7079","path_kind":"GIT_PATH"},"reason_code":"POLICY_INCLUDED","source_class":"FIRST_PARTY"},{"disposition":"IN_SCOPE","git_path":{"git_path_hex":"706c7567696e732f6769746875622d65766964656e63652f7372632f76657269747261696c5f6769746875622f7061697265645f636f6c6c656374696f6e2e7079","path_kind":"GIT_PATH"},"reason_code":"POLICY_INCLUDED","source_class":"FIRST_PARTY"},{"disposition":"IN_SCOPE","git_path":{"git_path_hex":"706c7567696e732f6769746875622d65766964656e63652f7372632f76657269747261696c5f6769746875622f7075626c69635f72656e6465725f62726f777365722e7079","path_kind":"GIT_PATH"},"reason_code":"POLICY_INCLUDED","source_class":"FIRST_PARTY"},{"disposition":"IN_SCOPE","git_path":{"git_path_hex":"706c7567696e732f6769746875622d65766964656e63652f7372632f76657269747261696c5f6769746875622f7075626c69635f72656e6465725f636f6c6c6563746f722e7079","path_kind":"GIT_PATH"},"reason_code":"POLICY_INCLUDED","source_class":"FIRST_PARTY"},{"disposition":"IN_SCOPE","git_path":{"git_path_hex":"706c7567696e732f6769746875622d65766964656e63652f7372632f76657269747261696c5f6769746875622f7075626c69635f72656e6465725f636f6e666f726d616e63652e7079","path_kind":"GIT_PATH"},"reason_code":"POLICY_INCLUDED","source_class":"FIRST_PARTY"},{"disposition":"IN_SCOPE","git_path":{"git_path_hex":"706c7567696e732f6769746875622d65766964656e63652f7372632f76657269747261696c5f6769746875622f7075626c69635f72656e6465725f636f6e74656e742e7079","path_kind":"GIT_PATH"},"reason_code":"POLICY_INCLUDED","source_class":"FIRST_PARTY"},{"disposition":"IN_SCOPE","git_path":{"git_path_hex":"706c7567696e732f6769746875622d65766964656e63652f7372632f76657269747261696c5f6769746875622f7075626c69635f72656e6465725f636f6e7472616374732e7079","path_kind":"GIT_PATH"},"reason_code":"POLICY_INCLUDED","source_class":"FIRST_PARTY"},{"disposition":"IN_SCOPE","git_path":{"git_path_hex":"706c7567696e732f6769746875622d65766964656e63652f7372632f76657269747261696c5f6769746875622f7075626c69635f72656e6465725f6e617669676174696f6e2e7079","path_kind":"GIT_PATH"},"reason_code":"POLICY_INCLUDED","source_class":"FIRST_PARTY"},{"disposition":"IN_SCOPE","git_path":{"git_path_hex":"706c7567696e732f6769746875622d65766964656e63652f7372632f76657269747261696c5f6769746875622f7075626c69635f72656e6465725f6e6574776f726b2e7079","path_kind":"GIT_PATH"},"reason_code":"POLICY_INCLUDED","source_class":"FIRST_PARTY"},{"disposition":"IN_SCOPE","git_path":{"git_path_hex":"706c7567696e732f6769746875622d65766964656e63652f7372632f76657269747261696c5f6769746875622f7075626c69635f72656e6465725f72756e74696d652e7079","path_kind":"GIT_PATH"},"reason_code":"POLICY_INCLUDED","source_class":"FIRST_PARTY"},{"disposition":"IN_SCOPE","git_path":{"git_path_hex":"706c7567696e732f6769746875622d65766964656e63652f7372632f76657269747261696c5f6769746875622f7075626c69736865722e7079","path_kind":"GIT_PATH"},"reason_code":"POLICY_INCLUDED","source_class":"FIRST_PARTY"},{"disposition":"IN_SCOPE","git_path":{"git_path_hex":"706c7567696e732f6769746875622d65766964656e63652f7372632f76657269747261696c5f6769746875622f7265666572656e63655f6c61622e7079","path_kind":"GIT_PATH"},"reason_code":"POLICY_INCLUDED","source_class":"FIRST_PARTY"},{"disposition":"IN_SCOPE","git_path":{"git_path_hex":"706c7567696e732f6769746875622d65766964656e63652f7372632f76657269747261696c5f6769746875622f7472616e73706f72742e7079","path_kind":"GIT_PATH"},"reason_code":"POLICY_INCLUDED","source_class":"FIRST_PARTY"}],"seal":{"algorithm":"sha256","digest":"b5c634a2192552ac6c1ae08ca917af947ce613c5ceb15e6a91ed7cadcdcff8f8"},"slice_policy":{"allowed_relations":[{"direction":"OUTBOUND","relation_kind":"LEXICAL_CONTAINS"},{"direction":"OUTBOUND","relation_kind":"IMPORT_TARGET_LITERAL"}],"anchor_fact_kinds":["MODULE"],"max_depth":1,"max_files":256,"max_relations":8192,"max_symbols":4096},"slice_policy_digest":"bc137efdb676a81d321b797679b44cedc46ee9863e50f4637277a1d7dd77ee81","source_snapshot_digest":"08d32840ef56f0c7c0edd6e51d1c64e40b8f476af9330961d1b10c0916b9aaaa","version":1}
