{"analysis_scope_digest":"7b47e00a7c7544149d5957ff918c13b3efb115665cac71774408157ecd00d8d1","artifact_kind":"REVIEW_POLICY","canonicalization_profile":"veritrail-json-c14n/1","derivation_profile_digest":"e8bbe54140ff2a082b69d6b6967d8630a423abd135ac6e7be0badc1fe053125b","execution_budget":{"artifact_bytes":16777216,"memory_bytes":268435456,"wall_clock_ms":10000},"governance":{"claim_owner_ref":"fixture-human","drafter_ref":"fixture-drafter","seal_authority_ref":"fixture-human","seal_decision":"CONFIRMED"},"policy_digest":"ba5d50b166e56a5d8ee3fd8fd56841e8008dd43196c1547840810eb3e6209c4a","policy_id":"fixture-policy","provider_requirements":[{"capability_id":"python-ast","composition_mode":"CUMULATIVE","required":true}],"python_module_mapping":{"module_root":{"path_kind":"REPOSITORY_ROOT"},"package_prefix":[]},"schema_version":"0.1","scope_decisions":[{"disposition":"IN_SCOPE","git_path":{"git_path_hex":"706b672f6d6f642e7079","path_kind":"GIT_PATH"},"reason_code":"POLICY_INCLUDED","source_class":"FIRST_PARTY"}],"seal":{"algorithm":"sha256","digest":"d2b373a0d6f2c8ee41d4ed2fd7a74c498c8df475706951f2749e56c837e62cbc"},"slice_policy":{"allowed_relations":[{"direction":"OUTBOUND","relation_kind":"LEXICAL_CONTAINS"},{"direction":"OUTBOUND","relation_kind":"IMPORT_TARGET_LITERAL"}],"anchor_fact_kinds":["MODULE"],"max_depth":1,"max_files":1,"max_relations":2,"max_symbols":2},"slice_policy_digest":"6633300a034ccfa2fe4d60a55215cf3c792479a8cdbf23404e9024b50fb6f4a4","source_snapshot_digest":"3acb02f99805fd684ff68a1e0d2a2e24a22d75232564a1f52646c89e4398f747","version":1}
